{
	"$schema": "../../../schemas/snippet.schema.json",
	"name": "Avstand i mobilmeny",
	"summary": "Gir mobilmenyen mer luft og beholder sticky-oppførsel uten å dekke innhold.",
	"category": "header",
	"subcategory": "mobile-menu",
	"tags": ["responsive", "mobile", "tablet", "desktop", "accessibility", "sticky"],
	"placement": {
		"location": "flatsome-custom-css-mobile",
		"notes": "Lim inn i feltet for mobil."
	},
	"updated": "2026-08-22"
}
