{
	"$schema": "../../../schemas/snippet.schema.json",
	"name": "Understrek på navigasjonslenker",
	"summary": "Viser en farget understrek på aktive og hovered lenker i headeren.",
	"category": "header",
	"subcategory": "navbar",
	"tags": ["links", "colors"],
	"placement": {
		"location": "flatsome-custom-css-all"
	},
	"updated": "2026-07-20"
}
